{
  "name": "Spellcasters Chronicles",
  "version": "0.0.1",
  "developer": "Quantic Dream",
  "publisher": "Quantic Dream",
  "genre": "3v3 Deckbuilder RTS MOBA",
  "monetization": "Free to Play (Cosmetic Microtransactions)",
  "description": "Spellcasters Chronicles is a 3v3 Deckbuilder RTS MOBA where players create decks of Spellcasters, Titans, and cards (Spells, Buildings, Creatures) to battle for control of the lanes.",
  "links": {
    "homepage": "https://www.spellcasterschronicles.com/en-US",
    "steam": "https://store.steampowered.com/app/2458470/Spellcasters_Chronicles/"
  },
  "status": "Dev",
  "changelog": [
    {
      "version": "0.0.1",
      "date": "2026-02-04T15:25:39.104407Z",
      "description": "Initial Closed Beta 2 Data"
    }
  ],
  "$schema": "../schemas/v2/game_config.schema.json"
}
